{
  "schemaVersion": "danteforge.time-machine.validation.v1",
  "runId": "tmval_20260430120144",
  "createdAt": "2026-04-30T12:01:44.595Z",
  "cwd": "C:\\Projects\\DanteForge",
  "outDir": "C:\\Projects\\DanteForge\\.danteforge\\time-machine\\validation\\pass-36-live-blocked",
  "scale": "smoke",
  "delegate52Mode": "live",
  "status": "partial",
  "summary": {
    "selectedClasses": [
      "D"
    ],
    "passedClasses": [],
    "partialClasses": [
      "D"
    ],
    "failedClasses": [],
    "claimsAllowed": [
      "Time Machine validation harness can generate deterministic tamper, restore, causal, adversarial, performance, and constitutional evidence.",
      "DELEGATE-52 harness/import/live paths are wired with public dataset limitations recorded."
    ],
    "claimsNotAllowed": [
      "Do not claim DanteForge has published full DELEGATE-52 live replication until live or imported results are present.",
      "Do not claim private/withheld DELEGATE-52 environments were validated from the public dataset."
    ]
  },
  "classes": {
    "D": {
      "status": "live_not_enabled",
      "publicReleasedDomains": 48,
      "publicReleasedRows": 234,
      "withheldEnvironments": 76,
      "liveBlockers": [
        "blocked_by_missing_live_confirmation",
        "blocked_by_missing_credentials",
        "blocked_by_missing_model"
      ],
      "domainRows": [
        {
          "domain": "public-domain-1",
          "mode": "live",
          "status": "live_not_enabled_explicit_budget_required",
          "corruptionRecovered": false,
          "causalSourceIdentified": false
        },
        {
          "domain": "public-domain-2",
          "mode": "live",
          "status": "live_not_enabled_explicit_budget_required",
          "corruptionRecovered": false,
          "causalSourceIdentified": false
        },
        {
          "domain": "public-domain-3",
          "mode": "live",
          "status": "live_not_enabled_explicit_budget_required",
          "corruptionRecovered": false,
          "causalSourceIdentified": false
        },
        {
          "domain": "public-domain-4",
          "mode": "live",
          "status": "live_not_enabled_explicit_budget_required",
          "corruptionRecovered": false,
          "causalSourceIdentified": false
        },
        {
          "domain": "public-domain-5",
          "mode": "live",
          "status": "live_not_enabled_explicit_budget_required",
          "corruptionRecovered": false,
          "causalSourceIdentified": false
        },
        {
          "domain": "public-domain-6",
          "mode": "live",
          "status": "live_not_enabled_explicit_budget_required",
          "corruptionRecovered": false,
          "causalSourceIdentified": false
        },
        {
          "domain": "public-domain-7",
          "mode": "live",
          "status": "live_not_enabled_explicit_budget_required",
          "corruptionRecovered": false,
          "causalSourceIdentified": false
        },
        {
          "domain": "public-domain-8",
          "mode": "live",
          "status": "live_not_enabled_explicit_budget_required",
          "corruptionRecovered": false,
          "causalSourceIdentified": false
        },
        {
          "domain": "public-domain-9",
          "mode": "live",
          "status": "live_not_enabled_explicit_budget_required",
          "corruptionRecovered": false,
          "causalSourceIdentified": false
        },
        {
          "domain": "public-domain-10",
          "mode": "live",
          "status": "live_not_enabled_explicit_budget_required",
          "corruptionRecovered": false,
          "causalSourceIdentified": false
        },
        {
          "domain": "public-domain-11",
          "mode": "live",
          "status": "live_not_enabled_explicit_budget_required",
          "corruptionRecovered": false,
          "causalSourceIdentified": false
        },
        {
          "domain": "public-domain-12",
          "mode": "live",
          "status": "live_not_enabled_explicit_budget_required",
          "corruptionRecovered": false,
          "causalSourceIdentified": false
        },
        {
          "domain": "public-domain-13",
          "mode": "live",
          "status": "live_not_enabled_explicit_budget_required",
          "corruptionRecovered": false,
          "causalSourceIdentified": false
        },
        {
          "domain": "public-domain-14",
          "mode": "live",
          "status": "live_not_enabled_explicit_budget_required",
          "corruptionRecovered": false,
          "causalSourceIdentified": false
        },
        {
          "domain": "public-domain-15",
          "mode": "live",
          "status": "live_not_enabled_explicit_budget_required",
          "corruptionRecovered": false,
          "causalSourceIdentified": false
        },
        {
          "domain": "public-domain-16",
          "mode": "live",
          "status": "live_not_enabled_explicit_budget_required",
          "corruptionRecovered": false,
          "causalSourceIdentified": false
        },
        {
          "domain": "public-domain-17",
          "mode": "live",
          "status": "live_not_enabled_explicit_budget_required",
          "corruptionRecovered": false,
          "causalSourceIdentified": false
        },
        {
          "domain": "public-domain-18",
          "mode": "live",
          "status": "live_not_enabled_explicit_budget_required",
          "corruptionRecovered": false,
          "causalSourceIdentified": false
        },
        {
          "domain": "public-domain-19",
          "mode": "live",
          "status": "live_not_enabled_explicit_budget_required",
          "corruptionRecovered": false,
          "causalSourceIdentified": false
        },
        {
          "domain": "public-domain-20",
          "mode": "live",
          "status": "live_not_enabled_explicit_budget_required",
          "corruptionRecovered": false,
          "causalSourceIdentified": false
        },
        {
          "domain": "public-domain-21",
          "mode": "live",
          "status": "live_not_enabled_explicit_budget_required",
          "corruptionRecovered": false,
          "causalSourceIdentified": false
        },
        {
          "domain": "public-domain-22",
          "mode": "live",
          "status": "live_not_enabled_explicit_budget_required",
          "corruptionRecovered": false,
          "causalSourceIdentified": false
        },
        {
          "domain": "public-domain-23",
          "mode": "live",
          "status": "live_not_enabled_explicit_budget_required",
          "corruptionRecovered": false,
          "causalSourceIdentified": false
        },
        {
          "domain": "public-domain-24",
          "mode": "live",
          "status": "live_not_enabled_explicit_budget_required",
          "corruptionRecovered": false,
          "causalSourceIdentified": false
        },
        {
          "domain": "public-domain-25",
          "mode": "live",
          "status": "live_not_enabled_explicit_budget_required",
          "corruptionRecovered": false,
          "causalSourceIdentified": false
        },
        {
          "domain": "public-domain-26",
          "mode": "live",
          "status": "live_not_enabled_explicit_budget_required",
          "corruptionRecovered": false,
          "causalSourceIdentified": false
        },
        {
          "domain": "public-domain-27",
          "mode": "live",
          "status": "live_not_enabled_explicit_budget_required",
          "corruptionRecovered": false,
          "causalSourceIdentified": false
        },
        {
          "domain": "public-domain-28",
          "mode": "live",
          "status": "live_not_enabled_explicit_budget_required",
          "corruptionRecovered": false,
          "causalSourceIdentified": false
        },
        {
          "domain": "public-domain-29",
          "mode": "live",
          "status": "live_not_enabled_explicit_budget_required",
          "corruptionRecovered": false,
          "causalSourceIdentified": false
        },
        {
          "domain": "public-domain-30",
          "mode": "live",
          "status": "live_not_enabled_explicit_budget_required",
          "corruptionRecovered": false,
          "causalSourceIdentified": false
        },
        {
          "domain": "public-domain-31",
          "mode": "live",
          "status": "live_not_enabled_explicit_budget_required",
          "corruptionRecovered": false,
          "causalSourceIdentified": false
        },
        {
          "domain": "public-domain-32",
          "mode": "live",
          "status": "live_not_enabled_explicit_budget_required",
          "corruptionRecovered": false,
          "causalSourceIdentified": false
        },
        {
          "domain": "public-domain-33",
          "mode": "live",
          "status": "live_not_enabled_explicit_budget_required",
          "corruptionRecovered": false,
          "causalSourceIdentified": false
        },
        {
          "domain": "public-domain-34",
          "mode": "live",
          "status": "live_not_enabled_explicit_budget_required",
          "corruptionRecovered": false,
          "causalSourceIdentified": false
        },
        {
          "domain": "public-domain-35",
          "mode": "live",
          "status": "live_not_enabled_explicit_budget_required",
          "corruptionRecovered": false,
          "causalSourceIdentified": false
        },
        {
          "domain": "public-domain-36",
          "mode": "live",
          "status": "live_not_enabled_explicit_budget_required",
          "corruptionRecovered": false,
          "causalSourceIdentified": false
        },
        {
          "domain": "public-domain-37",
          "mode": "live",
          "status": "live_not_enabled_explicit_budget_required",
          "corruptionRecovered": false,